doi,title,authors,year,month,volume,issue,page,article_number,type,subject,url
10.1016/j.fusengdes.2008.11.066,"Impact of d-Li source and (n,xγ) reaction gammas on the nuclear responses in the IFMIF test modules",S.P. Simakov; U. Fischer; P. Pereslavtsev,2009,6,84,7-11,1770-1773,,journal-article,,https://doi.org/10.1016/j.fusengdes.2008.11.066
10.1016/j.fusengdes.2008.11.049,Damage structure in divertor armor materials exposed to multiple ITER relevant ELM loads,K. Wittlich; T. Hirai; J. Compan; N. Klimov; J. Linke; A. Loarte; M. Merola; G. Pintsuk; V. Podkovyrov; L. Singheiser; A. Zhitlukhin,2009,6,84,7-11,1982-1986,,journal-article,,https://doi.org/10.1016/j.fusengdes.2008.11.049
10.1016/j.fusengdes.2009.01.093,A methodology to assess the impact of the manufacturing margins of the HCLL-TBM first wall in the design criteria,F. Gabriel; G. Aiello; J.-F. Salavy,2009,6,84,2-6,798-803,,journal-article,,https://doi.org/10.1016/j.fusengdes.2009.01.093
10.1016/j.fusengdes.2008.12.007,Hydrogen transport and trapping in the GlidCop Al25 IG alloy,G.A. Esteban; G. Alberro; I. Peñalva; A. Peña; F. Legarda; B. Riccardi,2009,6,84,2-6,757-761,,journal-article,,https://doi.org/10.1016/j.fusengdes.2008.12.007
10.1016/j.fusengdes.2008.12.100,Conceptual design of the quench protection circuits for the JT-60SA superconducting magnets,Elena Gaio; Luca Novello; Roberto Piovan; Katsuhiro Shimada; Tsunehisa Terakado; Kenichi Kurihara; Makoto Matsukawa,2009,6,84,2-6,804-809,,journal-article,,https://doi.org/10.1016/j.fusengdes.2008.12.100
10.1016/j.fusengdes.2009.01.048,Post-examination of helium-cooled tungsten components exposed to DEMO specific cyclic thermal loads,G. Ritz; T. Hirai; J. Linke; P. Norajitra; R. Giniyatulin; L. Singheiser,2009,6,84,7-11,1623-1627,,journal-article,,https://doi.org/10.1016/j.fusengdes.2009.01.048
10.1016/j.fusengdes.2008.12.030,"Deuterium permeation behavior of erbium oxide coating on austenitic, ferritic, and ferritic/martensitic steels",Takumi Chikada; Akihiro Suzuki; Zhenyu Yao; Denis Levchuk; Hans Maier; Takayuki Terai; Takeo Muroga,2009,6,84,2-6,590-592,,journal-article,,https://doi.org/10.1016/j.fusengdes.2008.12.030
10.1016/j.fusengdes.2008.11.086,Influence of various catalysts on the radiation resistance and the mechanical properties of cyanate ester/epoxy insulation systems,R. Prokopec; K. Humer; R.K. Maix; H. Fillunger; H.W. Weber,2009,6,84,7-11,1544-1547,,journal-article,,https://doi.org/10.1016/j.fusengdes.2008.11.086
10.1016/j.fusengdes.2009.01.042,Thermal structural analysis of SST-1 vacuum vessel and cryostat assembly using ANSYS,Prosenjit Santra; Vijay Bedakihale; Tata Ranganath,2009,6,84,7-11,1708-1712,,journal-article,,https://doi.org/10.1016/j.fusengdes.2009.01.042
10.1016/j.fusengdes.2008.12.008,The impact of specific surface area on the retention of deuterium in carbon fiber composite materials,R.D. Kolasinski; K.R. Umstadter; J.P. Sharpe; R.A. Causey; R.J. Pawelko; J.A. Whaley; D.A. Buchenauer; M. Shimada,2009,6,84,2-6,1068-1071,,journal-article,,https://doi.org/10.1016/j.fusengdes.2008.12.008
10.1016/j.fusengdes.2008.11.055,A bulk tungsten divertor row for the outer strike point in JET,Ph. Mertens; H. Altmann; T. Hirai; M. Knaup; O. Neubauer; V. Philipps; J. Rapp; V. Riccardo; S. Sadakov; B. Schweer; A. Terra; I. Uytdenhouwen; U. Samm,2009,6,84,7-11,1289-1293,,journal-article,,https://doi.org/10.1016/j.fusengdes.2008.11.055
10.1016/j.fusengdes.2009.01.037,Weld integrity of the superconducting cable aluminium jackets of W7-X,Joris Fellinger; Andrzej Dudek; Daniel Zacharias; Harald Dutz; Konrad Risse; Dag Hathiramani; Victor Bykov; Felix Schauer,2009,6,84,2-6,766-771,,journal-article,,https://doi.org/10.1016/j.fusengdes.2009.01.037
10.1016/j.fusengdes.2009.02.042,An improved procedure for radiochemical processing of activated fusion-reactor-relevant V–Cr–Ti alloy,S.A. Bartenev; B.N. Kolbasov; E.N. Li; P.V. Romanov; V.N. Romanovskij; N.G. Firsin,2009,6,84,2-6,427-429,,journal-article,,https://doi.org/10.1016/j.fusengdes.2009.02.042
10.1016/j.fusengdes.2008.12.069,Optimizing the overall configuration of a He-cooled W-alloy divertor for a power plant,A.R. Raffray; S. Malang; X. Wang,2009,6,84,7-11,1553-1557,,journal-article,,https://doi.org/10.1016/j.fusengdes.2008.12.069
10.1016/j.fusengdes.2009.01.039,Multipurpose ANSYS FE procedure for welding processes simulation,Andrea Capriccioli; Paolo Frosi,2009,6,84,2-6,546-553,,journal-article,,https://doi.org/10.1016/j.fusengdes.2009.01.039
10.1016/j.fusengdes.2009.02.032,Problems of lead nuclear data in fusion blanket design,Keitaro Kondo; Isao Murata; Axel Klix; Klaus Seidel; Hartwig Freiesleben,2009,6,84,7-11,1076-1080,,journal-article,,https://doi.org/10.1016/j.fusengdes.2009.02.032
10.1016/j.fusengdes.2008.12.037,Influence of non-metal inclusions on mechanical properties of CLAM steel,Shaojun Liu; Qunying Huang; Chunjing Li; Bo Huang,2009,6,84,7-11,1214-1218,,journal-article,,https://doi.org/10.1016/j.fusengdes.2008.12.037
10.1016/j.fusengdes.2009.03.013,Processing of the quench detection signals in W7-X,Dietrich Birus; Matthias Schneider; Thomas Rummel; Marko Fricke; Klaus Petry; Andreas Ebersoldt,2009,6,84,2-6,457-460,,journal-article,,https://doi.org/10.1016/j.fusengdes.2009.03.013
10.1016/j.fusengdes.2009.01.002,"Radiation resistant bolometers with Al2O3 and AlN substrates, anodized aluminium support frames, and improved electrical contacts",M. Gonzalez; E.R. Hodgson,2009,6,84,2-6,829-831,,journal-article,,https://doi.org/10.1016/j.fusengdes.2009.01.002
10.1016/j.fusengdes.2008.12.108,Thermal stability of hydrostatically extruded EUROFER 97 steel,Agnieszka T. Krawczynska; Malgorzata Lewandowska; Krzysztof J. Kurzydlowski,2009,6,84,7-11,1116-1118,,journal-article,,https://doi.org/10.1016/j.fusengdes.2008.12.108
10.1016/j.fusengdes.2008.12.039,Welding techniques development of CLAM steel for Test Blanket Module,Chunjing Li; Qunying Huang; Qingsheng Wu; Shaojun Liu; Yucheng Lei; Takeo Muroga; Takuya Nagasaka; Jianxun Zhang; Jinglong Li,2009,6,84,7-11,1184-1187,,journal-article,,https://doi.org/10.1016/j.fusengdes.2008.12.039
10.1016/j.fusengdes.2008.11.093,Thermal–hydraulic and thermo-structural analysis of first wall for Indian DEMO blanket module,Paritosh Chaudhuri; Chandan Danani; Vilas Chaudhari; C. Chakrapani; R. Srinivasan; I. Sandeep; E. Rajendra Kumar; S.P. Deshpande,2009,6,84,2-6,573-577,,journal-article,,https://doi.org/10.1016/j.fusengdes.2008.11.093
10.1016/j.fusengdes.2008.12.027,Feasibility study of the cut and weld operations by RH on the cooling pipes of ITER NB components,Oscar Piñeiro; Carlos Fernández; Mercedes Medrano; Macarena Liniers; Jose Botija; Javier Alonso; Xabier Sarasola; Carlo Damiani,2009,6,84,7-11,1515-1520,,journal-article,,https://doi.org/10.1016/j.fusengdes.2008.12.027
10.1016/j.fusengdes.2008.11.009,A review of physical and mechanical properties of titanium beryllides with specific modern application of TiBe12,Christopher K. Dorn; Warren J. Haws; Edgar E. Vidal,2009,6,84,2-6,319-322,,journal-article,,https://doi.org/10.1016/j.fusengdes.2008.11.009
10.1016/j.fusengdes.2008.11.054,Preliminary spectrum shifter design for intermediate energy nuclear data benchmark experiments with DT neutrons,Masayuki Ohta; Keitaro Kondo; Masayuki Matsunaka; Hiroyuki Miyamaru; Isao Murata; Toshiyuki Iida; Kentaro Ochiai; Chikara Konno,2009,6,84,7-11,1446-1449,,journal-article,,https://doi.org/10.1016/j.fusengdes.2008.11.054
10.1016/j.fusengdes.2009.01.008,Efficient helium cooling methods for nuclear fusion devices: Status and prospects,T. Ihli; M. Ilić,2009,6,84,2-6,964-968,,journal-article,,https://doi.org/10.1016/j.fusengdes.2009.01.008
10.1016/j.fusengdes.2008.12.038,Progress in compatibility experiments on lithium–lead with candidate structural materials for fusion in China,Qunying Huang; Sheng Gao; Zhiqiang Zhu; Maolian Zhang; Yong Song; Chunjing Li; Yaping Chen; Xinzhen Ling; Xingui Zhou,2009,6,84,2-6,242-246,,journal-article,,https://doi.org/10.1016/j.fusengdes.2008.12.038
10.1016/j.fusengdes.2009.02.046,"Corrosion characteristics of reduced activation ferritic steel, JLF-1 (8.92Cr–2W) in molten salts Flibe and Flinak",Masatoshi Kondo; Takuya Nagasaka; Qi Xu; Takeo Muroga; Akio Sagara; Nobuaki Noda; Daisuke Ninomiya; Masaru Nagura; Akihiro Suzuki; Takayuki Terai; Naoki Fujii,2009,6,84,7-11,1081-1085,,journal-article,,https://doi.org/10.1016/j.fusengdes.2009.02.046
10.1016/j.fusengdes.2009.04.001,Study of the helium-cooled lithium lead test blanket module nuclear behaviour under irradiation in ITER,P. Chiovaro; P.A. Di Maio; G. Vella,2009,12,84,12,2178-2186,,journal-article,,https://doi.org/10.1016/j.fusengdes.2009.04.001
10.1016/j.fusengdes.2009.04.009,Use of a new methodology for prediction of weld distortion and residual stresses using FE simulation applied to ITER vacuum vessel manufacture,J. Guirao; E. Rodríguez; A. Bayón; L. Jones,2009,12,84,12,2187-2196,,journal-article,,https://doi.org/10.1016/j.fusengdes.2009.04.009
10.1016/j.fusengdes.2009.04.003,Optimization for the tritium isotope separation factor and permeation by selecting temperature and thickness of the diffusion Pd–Ag alloy cathode,G. Bellanger,2009,12,84,12,2197-2205,,journal-article,,https://doi.org/10.1016/j.fusengdes.2009.04.003
10.1016/j.fusengdes.2009.02.013,"Electromagnetic analysis, structural integrity and progress on mechanical design of the ITER ferromagnetic insert",M. Morimoto; K. Ioki; A. Terasawa; Yu. Utin; V. Barabash; Y. Gribov,2009,12,84,12,2118-2123,,journal-article,,https://doi.org/10.1016/j.fusengdes.2009.02.013
10.1016/j.fusengdes.2009.01.078,Design issues and implications for structural integrity of fusion power plant components,Panagiotis J. Karditsas,2009,12,84,12,2104-2108,,journal-article,,https://doi.org/10.1016/j.fusengdes.2009.01.078
10.1016/j.fusengdes.2009.08.003,Transient high heat load tests on pure ultra-fine grained tungsten fabricated by resistance sintering under ultra-high pressure,Zhangjian Zhou; Gerald Pintsuk; Jochen Linke; Takeshi Hirai; Manfred Rödig; Yao Ma; Changchun Ge,2010,1,85,1,115-121,,journal-article,,https://doi.org/10.1016/j.fusengdes.2009.08.003
10.1016/j.fusengdes.2009.08.009,Geometry and expected performance of the solid tungsten outer divertor row in JET,J. Rapp; G. Pintsuk; Ph. Mertens; H. Altmann; P.J. Lomas; V. Riccardo,2010,4,85,2,153-160,,journal-article,,https://doi.org/10.1016/j.fusengdes.2009.08.009
10.1016/j.fusengdes.2009.11.003,Laser welding and ablation cutting process for hydraulic connections by remote handling in the ITER diagnostic port plug,S. Pak; Y. Kim; K.Y. Park; K.D. Lee; M.S. Cheon; H.G. Lee,2010,4,85,2,190-196,,journal-article,,https://doi.org/10.1016/j.fusengdes.2009.11.003
10.1016/j.fusengdes.2010.06.020,Vacuum plasma etching of 1wt% La2O3 dispersed tungsten,Jino Mathew; R.M. Mohanty; R. Sundaresan; V. Sivan; K. Balasubramanian,2010,8,85,5,824-827,,journal-article,,https://doi.org/10.1016/j.fusengdes.2010.06.020
10.1016/j.fusengdes.2010.03.034,Exact nuclear data uncertainty propagation for fusion neutronics calculations,D. Rochman; A.J. Koning; S.C. van der Marck,2010,8,85,5,669-682,,journal-article,,https://doi.org/10.1016/j.fusengdes.2010.03.034
10.1016/j.fusengdes.2010.03.008,Deuterium retention of boron–titanium and reduction of deuterium retention after helium ion irradiations,T. Hino; Y. Hashiba; Y. Yamauchi; K. Nishimura; N. Ashikawa; A. Sagara; N. Noda; A. Komori; O. Motojima,2010,8,85,5,655-660,,journal-article,,https://doi.org/10.1016/j.fusengdes.2010.03.008
10.1016/j.fusengdes.2010.05.026,Determination through the distortions analysis of the best welding sequence in longitudinal welds VATS electron beam welding FE simulation,J. Guirao; E. Rodríguez; A. Bayón; F. Bouyer; J. Pistono; L. Jones,2010,8,85,5,766-779,,journal-article,,https://doi.org/10.1016/j.fusengdes.2010.05.026
10.1016/j.fusengdes.2010.05.025,Analysis of welding distortion due to narrow-gap welding of upper port plug,Pankaj Biswas; N.R. Mandal; Parameswaran Vasu; Shrishail B. Padasalag,2010,8,85,5,780-788,,journal-article,,https://doi.org/10.1016/j.fusengdes.2010.05.025
10.1016/j.fusengdes.2010.06.002,Interfacial properties of HIP joints between beryllium and reduced activation ferritic/martensitic steel,T. Hirose; M. Ando; H. Ogiwara; H. Tanigawa; M. Enoeda; M. Akiba,2010,8,85,5,809-812,,journal-article,,https://doi.org/10.1016/j.fusengdes.2010.06.002
10.1016/j.fusengdes.2010.04.026,Properties of vacuum-deposited Li films and impact on plasma performance in TJ-II,F.L. Tabarés; D. Tafalla; J.A. Ferreira; M.A. Ochando; F. Medina,2010,11,85,6,910-914,,journal-article,,https://doi.org/10.1016/j.fusengdes.2010.04.026
10.1016/j.fusengdes.2010.06.019,Microstructure and mechanical properties of the TIG welded joints of fusion CLAM steel,Zhizhong Jiang; Litian Ren; Jihua Huang; Xin Ju; Huibin Wu; Qunying Huang; Yican Wu,2010,12,85,10-12,1903-1908,,journal-article,,https://doi.org/10.1016/j.fusengdes.2010.06.019
10.1016/j.fusengdes.2010.06.017,Must we use ferritic steel in TBM?,J.-F. Salavy; L.V. Boccaccini; P. Chaudhuri; S. Cho; M. Enoeda; L.M. Giancarli; R.J. Kurtz; T.Y. Luo; K. Bhanu Sankara Rao; C.P.C. Wong,2010,12,85,10-12,1896-1902,,journal-article,,https://doi.org/10.1016/j.fusengdes.2010.06.017
10.1016/j.fusengdes.2010.05.020,A conceptual design and structural stabilities of in-pit assembly tools for the completion of final sector assembly at tokamak hall,K.O. Nam; H.K. Park; D.J. Kim; H.J. Ahn; K.K. Kim; K. Im; R. Shaw,2010,12,85,10-12,1716-1719,,journal-article,,https://doi.org/10.1016/j.fusengdes.2010.05.020
10.1016/j.fusengdes.2010.04.043,First results on the effect of direct quenching on mechanical properties and anelastic relaxation in CLAM steel,J. Qiu; X. Ju; Y. Xin; S. Liu; S.H. Kang,2010,12,85,7-9,1556-1561,,journal-article,,https://doi.org/10.1016/j.fusengdes.2010.04.043
10.1016/j.fusengdes.2010.01.009,Hydrogen/dust explosion hazard in ITER: Effect of nitrogen dilution on explosion behavior of hydrogen/tungsten dust/air mixtures,A. Denkevits,2010,12,85,7-9,1059-1063,,journal-article,,https://doi.org/10.1016/j.fusengdes.2010.01.009
10.1016/j.fusengdes.2010.03.059,Investigation of coating CLAM steel substrates with erbium oxide by a magnetron sputtering method,Shuai Liu; Xin Ju; Yong Xin; Jie Qiu; Tao Li; Jiang Li Cao,2010,12,85,7-9,1401-1405,,journal-article,,https://doi.org/10.1016/j.fusengdes.2010.03.059
10.1016/j.fusengdes.2010.06.016,Overview of recent nuclear analyses for the Upper ECH launcher in ITER,A. Serikov; U. Fischer; D. Grosse; R. Heidinger; K. Kleefeldt; P. Spaeh; D. Strauss; A. Vaccaro,2010,12,85,10-12,1885-1895,,journal-article,,https://doi.org/10.1016/j.fusengdes.2010.06.016
10.1016/j.fusengdes.2010.03.012,Development of anti-corrosion coating on low activation materials against fluoridation and oxidation in Flibe blanket environment,Takuya Nagasaka; Masatoshi Kondo; Takeo Muroga; Akio Sagara; Osamu Motojima; Tatsuya Tsutsumi; Tatsuya Oishi,2010,12,85,7-9,1261-1265,,journal-article,,https://doi.org/10.1016/j.fusengdes.2010.03.012
10.1016/j.fusengdes.2010.04.014,Simulation on the welding of CLAM steel,Yu-cheng Lei; Qiang Zhu; Ling Zhang; Kang-jia Gu; Xin Ju,2010,12,85,7-9,1503-1507,,journal-article,,https://doi.org/10.1016/j.fusengdes.2010.04.014
10.1016/j.fusengdes.2010.01.001,Evaluation of microstructure and mechanical properties of liquid phase diffusion bonded ODS steels,Sanghoon Noh; Ryuta Kasada; Naoko Oono; Noriyuki Iwata; Akihiko Kimura,2010,12,85,7-9,1033-1037,,journal-article,,https://doi.org/10.1016/j.fusengdes.2010.01.001
10.1016/j.fusengdes.2010.04.008,Progress in the development of reduced activation ferritic-martensitic steels and fabrication technologies in India,Baldev Raj; K. Bhanu Sankara Rao; A.K. Bhaduri,2010,12,85,7-9,1460-1468,,journal-article,,https://doi.org/10.1016/j.fusengdes.2010.04.008
10.1016/j.fusengdes.2010.05.005,Simulation of tungsten armour cracking due to small ELMs in ITER,S. Pestchanyi; I. Garkusha; I. Landman,2010,12,85,7-9,1697-1701,,journal-article,,https://doi.org/10.1016/j.fusengdes.2010.05.005
10.1016/j.fusengdes.2010.04.045,Microstructure and mechanical property of 12Cr oxide dispersion strengthened ferritic steel for fusion application,Ming Li; Zhangjian Zhou; Pei He; Lu Liao; Yingli Xu; Changchun Ge,2010,12,85,7-9,1573-1576,,journal-article,,https://doi.org/10.1016/j.fusengdes.2010.04.045
10.1016/j.fusengdes.2010.03.058,Manufacturing studies of structural components for the ITER EC upper launcher,Peter Spaeh; Roland Heidinger; Klaus Kleefeldt; Franz Leher; Andreas Meier; Christian Obermeier; Theo Scherer; Arkady Serikov; Dirk Strauss; Alessandro Vaccaro,2010,12,85,7-9,1406-1409,,journal-article,,https://doi.org/10.1016/j.fusengdes.2010.03.058
10.1016/j.fusengdes.2010.04.066,Nitride-strengthened reduced activation ferritic/martensitic steels,Ping Hu; Wei Yan; Li-fen Deng; Wei Sha; Yi-yin Shan; Ke Yang,2010,12,85,7-9,1632-1637,,journal-article,,https://doi.org/10.1016/j.fusengdes.2010.04.066
10.1016/j.fusengdes.2010.09.008,"Design, interface development and structural analyses of SPIDER vacuum vessel",W. Rigato; M. Boldrin; S. DalBello; D. Marcuzzi; M. Tollin; P. Zaccaria,2010,12,85,10-12,2305-2311,,journal-article,,https://doi.org/10.1016/j.fusengdes.2010.09.008
10.1016/j.fusengdes.2010.04.032,Microstructure and thermal property of tungsten coatings prepared by vacuum plasma spraying technology,Yaran Niu; Xuebin Zheng; Heng Ji; Lingjun Qi; Chuanxian Ding; Junling Chen; Guangnan Luo,2010,12,85,7-9,1521-1526,,journal-article,,https://doi.org/10.1016/j.fusengdes.2010.04.032
10.1016/j.fusengdes.2010.05.014,Neutronics experiments on HCPB and HCLL TBM mock-ups in preparation of nuclear measurements in ITER,P. Batistoni; M. Angelone; P. Carconi; U. Fischer; K. Fleischer; K. Kondo; A. Klix; I. Kodeli; D. Leichtle; L. Petrizzi; M. Pillon; W. Pohorecki; M. Sommer; A. Trkov; R. Villari,2010,12,85,7-9,1675-1680,,journal-article,,https://doi.org/10.1016/j.fusengdes.2010.05.014
10.1016/j.fusengdes.2010.08.018,Development of advanced Al coating processes for future application as anti-corrosion and T-permeation barriers,J. Konys; W. Krauss; N. Holstein,2010,12,85,10-12,2141-2145,,journal-article,,https://doi.org/10.1016/j.fusengdes.2010.08.018
10.1016/j.fusengdes.2010.02.033,Molecular dynamics and dynamic Monte Carlo studies of mixed materials and their impact on plasma wall interactions,K. Ohya; N. Mohara; K. Inai; A. Ito; H. Nakamura; A. Kirschner; D. Borodin,2010,12,85,7-9,1167-1172,,journal-article,,https://doi.org/10.1016/j.fusengdes.2010.02.033
10.1016/j.fusengdes.2010.03.064,Corrosion of reduced activation ferritic martensitic steel JLF-1 in purified Flinak at static and flowing conditions,Masatoshi Kondo; Takuya Nagasaka; Valentyn Tsisar; Akio Sagara; Takeo Muroga; Takashi Watanabe; Tomoko Oshima; Yukihiro Yokoyama; Hiroshi Miyamoto; Eiji Nakamura; Naoki Fujii,2010,12,85,7-9,1430-1436,,journal-article,,https://doi.org/10.1016/j.fusengdes.2010.03.064
10.1016/j.fusengdes.2010.05.006,Effect of high temperature corrosion in liquid lithium on mechanical properties of beryllium,I.B. Kupriyanov; V.N. Kudryavtsev; L.A. Kurbatova; I.E. Lyublinski,2010,12,85,7-9,1702-1706,,journal-article,,https://doi.org/10.1016/j.fusengdes.2010.05.006
10.1016/j.fusengdes.2010.04.033,Microstructure control and deuterium permeability of erbium oxide coating on ferritic/martensitic steels by metal-organic decomposition,Takumi Chikada; Akihiro Suzuki; Teruya Tanaka; Takayuki Terai; Takeo Muroga,2010,12,85,7-9,1537-1541,,journal-article,,https://doi.org/10.1016/j.fusengdes.2010.04.033
10.1016/j.fusengdes.2010.09.004,"Optimization at the design phase of the potential impact of ITER on workers, the public and the environment",Pierre Cortes; Neill Taylor; Sandrine Rosanvallon; Lina Rodriguez-Rodrigo; Joelle Elbez-Uzan; Markus Iseli; Sergio Ciattaglia,2010,12,85,10-12,2263-2267,,journal-article,,https://doi.org/10.1016/j.fusengdes.2010.09.004
10.1016/j.fusengdes.2010.08.006,Effect of Fe and C doping on the thermal release of helium from aluminum,X. Xiang; C.A. Chen; K.Z. Liu; L.X. Peng; Y.C. Rao,2010,12,85,10-12,2086-2089,,journal-article,,https://doi.org/10.1016/j.fusengdes.2010.08.006
10.1016/j.fusengdes.2010.04.018,Molecular dynamics simulation of low-energy atomic hydrogen on tungsten surface,Zhongshi Yang; Qian Xu; Rongjie Hong; Qiang Li; Guang-Nan Luo,2010,12,85,7-9,1517-1520,,journal-article,,https://doi.org/10.1016/j.fusengdes.2010.04.018
10.1016/j.fusengdes.2010.04.028,Evaluation of deuterium permeation reduction factor of various coatings deposited on ferritic/martensitic steels for development of tritium permeation barrier,Hirofumi Nakamura; Kanetsugu Isobe; Masaru Nakamichi; Toshihiko Yamanishi,2010,12,85,7-9,1531-1536,,journal-article,,https://doi.org/10.1016/j.fusengdes.2010.04.028
10.1016/j.fusengdes.2010.06.014,Safety of fusion magnets: Pressure impact on arcing in model experiments to high-current arcs propagating along the busbars of large fusion magnet coils,Dmitry Klimenko; Volker Pasler,2010,12,85,10-12,1875-1879,,journal-article,,https://doi.org/10.1016/j.fusengdes.2010.06.014
10.1016/j.fusengdes.2010.06.021,Corrosion analysis of CLAM steel in flowing liquid LiPb at 480°C,Yaping Chen; Qunying Huang; Sheng Gao; Zhiqiang Zhu; Xinzhen Ling; Yong Song; Yunlong Chen; Weihua Wang,2010,12,85,10-12,1909-1912,,journal-article,,https://doi.org/10.1016/j.fusengdes.2010.06.021
10.1016/j.fusengdes.2010.01.002,Three-dimensional nuclear analysis for the US dual coolant lead lithium ITER test blanket module,M.E. Sawan; B. Smith; E.P. Marriott; P.P.H. Wilson,2010,12,85,7-9,1027-1032,,journal-article,,https://doi.org/10.1016/j.fusengdes.2010.01.002
10.1016/j.fusengdes.2010.03.020,The impact of lithium wall coatings on NSTX discharges and the engineering of the Lithium Tokamak eXperiment (LTX),R. Majeski; H. Kugel; R. Kaita; S. Avasarala; M.G. Bell; R.E. Bell; L. Berzak; P. Beiersdorfer; S.P. Gerhardt; E. Granstedt; T. Gray; C. Jacobson; J. Kallman; S. Kaye; T. Kozub; B.P. LeBlanc; J. Lepson; D.P. Lundberg; R. Maingi; D. Mansfield; S.F. Paul; G.V. Pereverzev; H. Schneider; V. Soukhanovskii; T. Strickler; D. Stotler; J. Timberlake; L.E. Zakharov,2010,12,85,7-9,1283-1289,,journal-article,,https://doi.org/10.1016/j.fusengdes.2010.03.020
10.1016/j.fusengdes.2010.08.043,Thermal conductivity and thermal expansion coefficient of diamond/5wt%Si–Cu composite by vacuum hot pressing,Weiping Shen; Weijun Shao; Qingyun Wang; Mingliang Ma,2010,12,85,10-12,2237-2240,,journal-article,,https://doi.org/10.1016/j.fusengdes.2010.08.043
10.1016/j.fusengdes.2010.02.034,"3D assessment of nuclear heating, dose rate, and structural damage in the generic ITER diagnostics upper port plugs and adjacent magnet coils",Mahmoud Z. Youssef; Russell Feder,2010,12,85,7-9,1173-1180,,journal-article,,https://doi.org/10.1016/j.fusengdes.2010.02.034
10.1016/j.fusengdes.2010.02.012,Preparation of Mg and Al phosphate coatings on ferritic steel by wet-chemical method as tritium permeation barrier,Kun Zhang; Yuji Hatano,2010,12,85,7-9,1090-1093,,journal-article,,https://doi.org/10.1016/j.fusengdes.2010.02.012
10.1016/j.fusengdes.2010.01.023,Status of R&amp;D on fusion materials in institute of nuclear materials in USTB,Ge Chang-Chun; Zhou Zhang-Jian; Shen Wei-Ping; Yan Qing-Zhi; Zhang Ying-Chun; Wang Shu-Ming; Ma Rong; Li Xing-Gang; Yang Ying,2010,12,85,7-9,1080-1084,,journal-article,,https://doi.org/10.1016/j.fusengdes.2010.01.023
10.1016/j.fusengdes.2010.07.011,Fiber erosion of carbon fiber composite exposed to simulated ITER-relevant thermal impact by high-intensity pulsed ion beam,X.P. Zhu; Y. Tang; X. Wang; M.K. Lei,2010,12,85,10-12,1999-2004,,journal-article,,https://doi.org/10.1016/j.fusengdes.2010.07.011
10.1016/j.fusengdes.2010.06.007,Deuterium retention and desorption behavior of reduced activated ferritic steel with surface damage due to high energy helium ion irradiation,Y. Yamauchi; K. Gotoh; Y. Nobuta; T. Hino; S. Suzuki; M. Akiba,2010,12,85,10-12,1838-1840,,journal-article,,https://doi.org/10.1016/j.fusengdes.2010.06.007
10.1016/j.fusengdes.2010.04.020,The development of joining doped graphite to copper for first wall application in HT-7 tokamak,Zhangjian Zhou; Zhihong Zhong; Junling Chen; Changchun Ge,2010,12,85,7-9,1513-1516,,journal-article,,https://doi.org/10.1016/j.fusengdes.2010.04.020
10.1016/j.fusengdes.2009.12.001,Interfacial reaction and diffusion control between SiC and F82H steel,Zhihong Zhong; Tatsuya Hinoki; Yi-Hyun Park; Akira Kohyama,2010,12,85,7-9,992-997,,journal-article,,https://doi.org/10.1016/j.fusengdes.2009.12.001
10.1016/j.fusengdes.2010.09.005,Advanced electro-chemical processing of tungsten components for He-cooled divertor application,W. Krauss; N. Holstein; J. Konys,2010,12,85,10-12,2257-2262,,journal-article,,https://doi.org/10.1016/j.fusengdes.2010.09.005
10.1016/j.fusengdes.2010.05.015,Progress on an integrated multi-physics simulation predictive capability for plasma chamber nuclear components,A. Ying; M. Abdou; H. Zhang; R. Munipalli; M. Ulrickson; M. Sawan; B. Merrill,2010,12,85,7-9,1681-1688,,journal-article,,https://doi.org/10.1016/j.fusengdes.2010.05.015
10.1016/j.fusengdes.2010.08.015,Recent US activities on advanced He-cooled W-alloy divertor concepts for fusion power plants,M.S. Tillack; A.R. Raffray; X.R. Wang; S. Malang; S. Abdel-Khalik; M. Yoda; D. Youchison,2011,1,86,1,71-98,,journal-article,,https://doi.org/10.1016/j.fusengdes.2010.08.015
10.1016/j.fusengdes.2010.09.018,Behaviour of Ti-doped CFCs under thermal fatigue tests,A. Centeno; G. Pintsuk; J. Linke; C. Gualco; C. Blanco; R. Santamaría; M. Granda; R. Menéndez,2011,1,86,1,121-125,,journal-article,,https://doi.org/10.1016/j.fusengdes.2010.09.018
