doi,title,authors,year,month,volume,issue,page,article_number,type,subject,url
10.1016/j.fusengdes.2016.10.010,Modification of preheated tungsten surface after irradiation at the GOL-3 facility,A.A. Shoshin; A.S. Arakcheev; A.V. Arzhannikov; A.V. Burdakov; A. Huber; I.A. Ivanov; K.N. Kuklin; S.V. Polosatkin; V.V. Postupaev; S.L. Sinitsky; A.A. Vasilyev,2016,12,113,,66-70,,journal-article,,https://doi.org/10.1016/j.fusengdes.2016.10.010
10.1016/j.fusengdes.2016.10.014,Structural impact of armor monoblock dimensions on the failure behavior of ITER-type divertor target components: Size matters,Muyuan Li; Jeong-Ha You,2016,12,113,,162-170,,journal-article,,https://doi.org/10.1016/j.fusengdes.2016.10.014
10.1016/j.fusengdes.2016.09.010,Study on the poisoning resistance of Pd-coated ZrCo alloy prepared by electroless plating method,Xiumei Guo; Shumao Wang; Zhinian Li; Baolong Yuan; Jianhua Ye; Haochen Qiu; Yuanfang Wu; Xiaopeng Liu; Lijun Jiang,2016,12,113,,195-200,,journal-article,,https://doi.org/10.1016/j.fusengdes.2016.09.010
10.1016/j.fusengdes.2016.03.069,First-principles study on the structural and electronic properties of Li4SiO4 and Al-doped Li4SiO4,Linjie Zhao; Qiushi Guan; Jiamao Li; Jian Zheng; Xiaojun Chen; Chengjian Xiao; Yu Gong; Xinggui Long; Shuming Peng,2016,12,113,,331-335,,journal-article,,https://doi.org/10.1016/j.fusengdes.2016.03.069
10.1016/j.fusengdes.2016.09.009,Deuterium permeation behavior of HTUPS4 steel with thermal oxidation layer,Yu-Ping Xu; Feng Liu; Si-Xiang Zhao; Xiao-Chun Li; Jing Wang; Zhong-Qing An; Tao Lu; Hao-Dong Liu; Fang Ding; Hai-Shan Zhou; Guang-Nan Luo,2016,12,113,,201-204,,journal-article,,https://doi.org/10.1016/j.fusengdes.2016.09.009
10.1016/j.fusengdes.2016.08.013,Tracking of tritium charged into stainless steel by BIXS,Masao Matsuyama; Shinsuke Abe,2016,12,113,,250-254,,journal-article,,https://doi.org/10.1016/j.fusengdes.2016.08.013
10.1016/j.fusengdes.2016.02.060,Influence of displacement damages on deuterium retention in reduced activation ferritic/martensitic steels F82H and Eurofer97,Vladimir Kh. Alimov; Yuji Hatano; Kazuyoshi Sugiyama; Sosuke Kondo; Tatsuya Hinoki; Masayuki Tokitani,2016,12,113,,336-339,,journal-article,,https://doi.org/10.1016/j.fusengdes.2016.02.060
10.1016/j.fusengdes.2016.07.023,Deuterium retention in molten salt electrodeposition tungsten coatings,Hai-Shan Zhou; Yu-Ping Xu; Ning-Bo Sun; Ying-Chun Zhang; Yasuhisa Oya; Ming-Zhong Zhao; Hong-Min Mao; Fang Ding; Feng Liu; Guang-Nan Luo,2016,12,113,,265-268,,journal-article,,https://doi.org/10.1016/j.fusengdes.2016.07.023
10.1016/j.fusengdes.2016.11.017,Mechanical properties and precipitation evolution behavior of V–5Cr–5Ti alloy after cold rolling,Z.D. Li; Q. Li; Y. Li; C.G. Lin; S. Cui; T.D. Ma,2017,1,114,,76-83,,journal-article,,https://doi.org/10.1016/j.fusengdes.2016.11.017
10.1016/j.fusengdes.2016.12.005,Transient thermo-structural and static magnetic characteristics of 1:1 prototype JET ELM control coils,Ananya Kundu; Subrata Pradhan; Mahesh Ghate; Deven Kanabar; Swati Roy; Nitish Kumar,2017,1,114,,203-210,,journal-article,,https://doi.org/10.1016/j.fusengdes.2016.12.005
10.1016/j.fusengdes.2016.11.011,Effect of zirconium addition on the microstructure and mechanical properties of 15Cr-ODS ferritic Steels consolidated by hot isostatic pressing,Haijian Xu; Zheng Lu; Dongmei Wang; Chunming Liu,2017,1,114,,33-39,,journal-article,,https://doi.org/10.1016/j.fusengdes.2016.11.011
10.1016/j.fusengdes.2016.11.013,Fabrication of three layered W-Cu functionally graded composite via spark plasma sintering,Ali Yusefi; Nader Parvin,2017,1,114,,196-202,,journal-article,,https://doi.org/10.1016/j.fusengdes.2016.11.013
10.1016/j.fusengdes.2016.11.018,Effect of Tantalum content on the low cycle fatigue properties of CLAM steel at 823 K,Xiangwei Zhai; Shaojun Liu; Yanyun Zhao; Kun Wang,2017,1,114,,211-218,,journal-article,,https://doi.org/10.1016/j.fusengdes.2016.11.018
10.1016/j.fusengdes.2016.12.010,Benchmark experiment on molybdenum with graphite by using DT neutrons at JAEA/FNS,Masayuki Ohta; Saerom Kwon; Satoshi Sato; Chikara Konno; Kentaro Ochiai,2017,1,114,,127-130,,journal-article,,https://doi.org/10.1016/j.fusengdes.2016.12.010
10.1016/j.fusengdes.2016.12.012,Kinetic Monte Carlo simulation of hydrogen diffusion in tungsten,Xue Yang; Wasiu O. Oyeniyi,2017,1,114,,113-117,,journal-article,,https://doi.org/10.1016/j.fusengdes.2016.12.012
10.1016/j.fusengdes.2016.12.037,Effect of thermal aging on grain structural characteristic and Ductile-to-Brittle transition temperature of CLAM steel at 550°C,Wei Wang; Jianwei Chen; Gang Xu,2017,2,115,,74-79,,journal-article,,https://doi.org/10.1016/j.fusengdes.2016.12.037
10.1016/j.fusengdes.2017.01.001,Effects of sequential helium and hydrogen ion irradiation on the nucleation and evolution of bubbles in tungsten,Zhenyu Shen; Zhongcheng Zheng; Fengfeng Luo; Wenhui Hu; Weiping Zhang; Liping Guo; Yaoyao Ren,2017,2,115,,80-84,,journal-article,,https://doi.org/10.1016/j.fusengdes.2017.01.001
10.1016/j.fusengdes.2016.12.034,Microstructures and mechanical properties of 9Cr oxide dispersion strengthened steel produced by spark plasma sintering,Rui Xie; Zheng Lu; Chenyang Lu; Zhengyuan Li; Xueyong Ding; Chunming Liu,2017,2,115,,67-73,,journal-article,,https://doi.org/10.1016/j.fusengdes.2016.12.034
10.1016/j.fusengdes.2017.01.034,Desorption of protium and deuterium from different types of titanium beds,Eusebiu Ilarian Ionete; Kris Dylst; Costeanu Claudiu Gheorghe; Spiridon Ionut Stefan; Monea Bogdan Florian; Wouter Broeckx,2017,3,116,,61-65,,journal-article,,https://doi.org/10.1016/j.fusengdes.2017.01.034
10.1016/j.fusengdes.2017.02.050,Determination of elastic modulus for hollow spherical shells via resonant ultrasound spectroscopy,Xiaojun Ma; Xing Tang; Zongwei Wang; Qian Chen; Menglu Qian; Jie Meng; Yongjian Tang; Hao Shen; Dangzhong Gao,2017,4,117,,74-78,,journal-article,,https://doi.org/10.1016/j.fusengdes.2017.02.050
10.1016/j.fusengdes.2017.02.052,Research on extrusion process of 316LN stainless rectangle thick-wall tube used in ITER top and bottom correction coils,Leifeng Tuo; Genshu Zhou; Xitang Kang; Congfei Song,2017,4,117,,79-87,,journal-article,,https://doi.org/10.1016/j.fusengdes.2017.02.052
10.1016/j.fusengdes.2016.10.011,Hydrogen retention studies on lithiated tungsten exposed to glow discharge plasmas under varying lithiation environments using Thermal Desorption Spectroscopy and mass spectrometry,A. de Castro; P. Valson; F.L. Tabarés,2017,4,117,,212-216,,journal-article,,https://doi.org/10.1016/j.fusengdes.2016.10.011
10.1016/j.fusengdes.2016.12.031,Behavior of liquid Li-Sn alloy as plasma facing material on ISTTOK,J.P.S. Loureiro; F.L. Tabarés; H. Fernandes; C. Silva; R. Gomes; E. Alves; R. Mateus; T. Pereira; H. Alves; H. Figueiredo,2017,4,117,,208-211,,journal-article,,https://doi.org/10.1016/j.fusengdes.2016.12.031
10.1016/j.fusengdes.2017.02.004,Effects of low energy helium plasma irradiation on potassium doped tungsten,Xiaoyan Shu; Bo Huang; Dongping Liu; Hongyu Fan; Ning Liu; Jun Tang,2017,4,117,,8-13,,journal-article,,https://doi.org/10.1016/j.fusengdes.2017.02.004
10.1016/j.fusengdes.2016.08.010,Analysis of LiSn alloy at several depths using LIBS,M. Suchoňová; J. Krištof; M. Pribula; M. Veis; F.L. Tabarés; P. Veis,2017,4,117,,175-179,,journal-article,,https://doi.org/10.1016/j.fusengdes.2016.08.010
10.1016/j.fusengdes.2016.06.055,Development of the reactor lithium ampoule device for research of spectral-luminescent characteristics of nuclear-excited plasma,E.G. Batyrbekov; Yu. N. Gordienko; Yu. V. Ponkratov; M.U. Khasenov; I.L. Tazhibayeva; N.I. Barsukov; T.V. Kulsartov; Zh. A. Zaurbekova; Ye. Yu. Tulubayev; M.K. Skakov,2017,4,117,,204-207,,journal-article,,https://doi.org/10.1016/j.fusengdes.2016.06.055
10.1016/j.fusengdes.2017.03.063,"Assessment of corrosion phenomena in liquid lithium at T &lt; 873 K. A Li(d,n) neutron source as case study",J. Knaster; P. Favuzza,2017,5,118,,135-141,,journal-article,,https://doi.org/10.1016/j.fusengdes.2017.03.063
10.1016/j.fusengdes.2017.03.145,Viscoplastic equations incorporated into a finite element model to predict deformation behavior of irradiated reduced activation ferritic/martensitic steel,Yuanyuan Wang; Jijun Zhao; Chi Zhang,2017,5,118,,129-134,,journal-article,,https://doi.org/10.1016/j.fusengdes.2017.03.145
10.1016/j.fusengdes.2017.03.093,Irradiation creep lifetime analysis on first wall structure materials for CFETR,Bing Ma; Lei Peng; Xiansheng Zhang; Jingyi Shi; Jie Zhan,2017,5,118,,117-123,,journal-article,,https://doi.org/10.1016/j.fusengdes.2017.03.093
10.1016/j.fusengdes.2017.05.006,Plasma facing component with built-in tungsten wires and a W-Cu functionally graded layer: A finite element assessment,Dan Sun; Yuanyuan Wang; Shaosong Huang; Jijun Zhao; Guanghua Liu; Jiangtao Li,2017,7,120,,9-14,,journal-article,,https://doi.org/10.1016/j.fusengdes.2017.05.006
10.1016/j.fusengdes.2017.04.116,Positron annihilation lifetime studies of stainless steel under proton and Xe irradiation,Chaoliang Xu; Guodong Zhang; Wangjie Qian; Jinna Mei; Xiangbing Liu; Chengtao Li; Fei Xue; Jinyu Li; Huiping Liu,2017,7,120,,34-38,,journal-article,,https://doi.org/10.1016/j.fusengdes.2017.04.116
10.1016/j.fusengdes.2017.04.084,Investigation of fabrication of hollow plate with complex flow paths for the breeding blanket by explosive weld,Mianjun Duan; Huanliang Li; Hong Ran; Jihong Wu; Yaohua Wang,2017,7,120,,15-20,,journal-article,,https://doi.org/10.1016/j.fusengdes.2017.04.084
10.1016/j.fusengdes.2017.04.102,Degradation of tungsten monoblock divertor under cyclic high heat flux loading,Shuhei Nogami; Michitoshi Toyota; Wenhai Guan; Akira Hasegawa; Yoshio Ueda,2017,7,120,,49-60,,journal-article,,https://doi.org/10.1016/j.fusengdes.2017.04.102
10.1016/j.fusengdes.2017.07.026,"Effects of TiC content on microstructure, mechanical properties, and thermal conductivity of W-TiC alloys fabricated by a wet-chemical method",Shaoting Lang; Qingzhi Yan; Ningbo Sun; Xiaoxin Zhang; Changchun Ge,2017,10,121,,366-372,,journal-article,,https://doi.org/10.1016/j.fusengdes.2017.07.026
10.1016/j.fusengdes.2017.06.039,"Effects of Y 2 O 3 , La 2 O 3 and CeO 2 additions on microstructure and mechanical properties of 14Cr-ODS ferrite alloys produced by spark plasma sintering",Zhengyuan Li; Zheng Lu; Rui Xie; Chenyang Lu; Yingnan Shi; Chunming Liu,2017,10,121,,159-166,,journal-article,,https://doi.org/10.1016/j.fusengdes.2017.06.039
10.1016/j.fusengdes.2017.07.015,The influences of deuterium irradiation defects on mechanical properties for ceramic breeder material Li 2 TiO 3,Jing Wang; Maoqiao Xiang; Yuping Xu; Feng Liu; Tao Lu; Haodong Liu; Haishan Zhou; Guang-nan Luo; Qiang Qi,2017,10,121,,182-187,,journal-article,,https://doi.org/10.1016/j.fusengdes.2017.07.015
10.1016/j.fusengdes.2017.06.015,Assessment of HCLL-TBM optimum welding sequence scenario to minimize welding distortions,Olivier Doyen; Nicola Rizzo; Laurent Forest; Jérôme Tosi; Noel Thomas; Milan Zmitko,2017,10,121,,80-86,,journal-article,,https://doi.org/10.1016/j.fusengdes.2017.06.015
10.1016/j.fusengdes.2017.07.016,A comprehensive solution to miniaturized tensile testing: Specimen geometry optimization and extraction of constitutive behaviors using inverse FEM procedure,Haiting Liu; Yao Shen; Shuang Yang; Pengfei Zheng; Lei Zhang,2017,10,121,,188-197,,journal-article,,https://doi.org/10.1016/j.fusengdes.2017.07.016
10.1016/j.fusengdes.2017.04.120,The effect of inert gas pre-irradiation on the retention of deuterium in tungsten: A TMAP investigation combined with first-principles method,Shi-Yao Qin; Shuo Jin; Da-Ren Zou; Long Cheng; Xiao-Lin Shu; Qing Hou; Guang-Hong Lu,2017,10,121,,342-347,,journal-article,,https://doi.org/10.1016/j.fusengdes.2017.04.120
10.1016/j.fusengdes.2017.06.009,Post examination of tungsten monoblocks subjected to high heat flux tests of ITER full-tungsten divertor qualification program,Zhaoxuan Sun; Qiang Li; Wanjing Wang; Ji-Chao Wang; Xingli Wang; Ran Wei; Chunyi Xie; Guang-nan Luo; T. Hirai; F Escourbiac; S. Panayotis,2017,10,121,,60-69,,journal-article,,https://doi.org/10.1016/j.fusengdes.2017.06.009
10.1016/j.fusengdes.2017.05.043,Vacancy like defects and hardening of tungsten under irradiation with He ions at 800 °C,M.H. Cui; T.L. Shen; H.P. Zhu; J. Wang; X.Z. Cao; P. Zhang; L.L. Pang; C.F. Yao; K.F. Wei; Y.B. Zhu; B.S. Li; J.R. Sun; N. Gao; X. Gao; H.P. Zhang; Y.B. Sheng; H.L. Chang; W.H. He; Z.G. Wang,2017,10,121,,313-318,,journal-article,,https://doi.org/10.1016/j.fusengdes.2017.05.043
10.1016/j.fusengdes.2017.06.027,Hydrogen susceptibility of nano-sized oxide dispersed austenitic steel for fusion reactor,Seung-Wook Baek; Eun Ju Song; Jung Hyun Kim; Yun-Hee Lee; Kwon Sang Ryu; Sa-Woong Kim,2017,10,121,,105-110,,journal-article,,https://doi.org/10.1016/j.fusengdes.2017.06.027
10.1016/j.fusengdes.2017.07.019,The effect of titanium(Ti) doping on hydrogen incorporation in tungsten(W)：First-principles calculations,D.Y. Jiang; C.Y. Ouyang; S.Q. Liu,2017,10,121,,227-234,,journal-article,,https://doi.org/10.1016/j.fusengdes.2017.07.019
10.1016/j.fusengdes.2017.08.006,Study on the mechanical behaviors and elastic modulus of mixed fusion pebble beds,Yuanjie Li; Bin Jia; Sheng Zhang; Xiaoliang Wang,2017,10,121,,356-360,,journal-article,,https://doi.org/10.1016/j.fusengdes.2017.08.006
10.1016/j.fusengdes.2017.08.012,Recrystallization behavior after annealing and thermal shock tests of W-K-TiC alloy,Ke Shi; Bo Huang; Bo He; Ye Xiao; Lun Chen; Youyun Lian; Xiang Liu; Jun Tang,2017,11,122,,223-227,,journal-article,,https://doi.org/10.1016/j.fusengdes.2017.08.012
10.1016/j.fusengdes.2017.04.078,Neutral beam remote cutting &amp; welding development,Luke Thomson; Jerome Woodwark; Cameron Kennedy; Alex Muir; Victor Agudo; Ian Merrigan; Robin Shuff; Marco Van Uffelen; Chang-Hwan Choi,2017,11,124,,487-491,,journal-article,,https://doi.org/10.1016/j.fusengdes.2017.04.078
10.1016/j.fusengdes.2017.01.043,Investigations on tungsten heavy alloys for use as plasma facing material,R. Neu; H. Maier; M. Balden; S. Elgeti; H. Gietl; H. Greuner; A. Herrmann; A. Houben; V. Rohde; B. Sieglin; I. Zammuto,2017,11,124,,450-454,,journal-article,,https://doi.org/10.1016/j.fusengdes.2017.01.043
10.1016/j.fusengdes.2017.04.098,Design and structural analysis of ITER upending tool for sector sub-assembly,Jinho Bae; Min-Su Ha; Kyoungo Nam; Sikun Chung; Soo-Hyeon Park; Wooho Chung; Jaewhan Moon; Hyunsoon Lee,2017,11,123,,115-119,,journal-article,,https://doi.org/10.1016/j.fusengdes.2017.04.098
10.1016/j.fusengdes.2017.03.157,Deformation of dissimilar-metals joint between F82H and 316L in impact tests after neutron irradiation,Haiying Fu; Takuya Nagasaka; Masanori Yamazaki; Takeshi Toyama; Wenhai Guan; Shuhei Nogami; Hisashi Serizawa; Hiroyasu Tanigawa,2017,11,124,,1063-1067,,journal-article,,https://doi.org/10.1016/j.fusengdes.2017.03.157
10.1016/j.fusengdes.2017.05.123,RAMI analysis for EAST upper full tungsten divertor water cooling system,Shijun Qin; Yang Zhang; Tiejun Xu; Lei Cao; Kun Lu; Zhuang Xu; Damao Yao; Shengming Wang; Yuntao Song,2017,11,124,,1181-1186,,journal-article,,https://doi.org/10.1016/j.fusengdes.2017.05.123
10.1016/j.fusengdes.2017.02.087,Overview of the different processes of tungsten coating implemented into WEST tokamak,M. Firdaouss; C. Desgranges; C. Hernandez; M. Richou; H. Greuner; B. Böswirth; I. Zacharie-Aubrun; T. Blay; J. Bucalossi; M. Missirlian; F. Samaille; E. Tsitrone,2017,11,124,,207-210,,journal-article,,https://doi.org/10.1016/j.fusengdes.2017.02.087
10.1016/j.fusengdes.2017.04.062,Effect of atmospheric control during MA-HIP process on mechanical properties of oxide dispersion-strengthened Cu alloy,H. Noto; T. Yamada; Y. Hishinuma; T. Muroga,2017,11,124,,1024-1027,,journal-article,,https://doi.org/10.1016/j.fusengdes.2017.04.062
10.1016/j.fusengdes.2017.04.025,Laser energy absorption coefficient and in-situ temperature measurement of laser-melted tungsten,T. Maeji; K. Ibano; S. Yoshikawa; D. Inoue; S. Kuroyanagi; K. Mori; E. Hoashi; K. Yamanoi; N. Sarukura; Y. Ueda,2017,11,124,,287-291,,journal-article,,https://doi.org/10.1016/j.fusengdes.2017.04.025
10.1016/j.fusengdes.2017.04.023,The impact on remote maintenance of varying the aspect ratio and number of TF coils for DEMO,Dan Wolff; Matti Coleman; David Cooper; Oliver Crofts; Jonathan Horne; Jonathan Keep; Antony Loving,2017,11,124,,553-557,,journal-article,,https://doi.org/10.1016/j.fusengdes.2017.04.023
10.1016/j.fusengdes.2017.05.059,"SiC-based sandwich material for Flow Channel Inserts in DCLL blankets: Manufacturing, characterization, corrosion tests",Carlota Soto; Carmen García-Rosales; Jon Echeberria; José M. Martínez-Esnaola; Teresa Hernández; Marta Malo; Ernests Platacis; Faina Muktepavela,2017,11,124,,958-963,,journal-article,,https://doi.org/10.1016/j.fusengdes.2017.05.059
10.1016/j.fusengdes.2017.02.043,Strong sub-surface plastic deformation induced by high flux plasma in tungsten,D. Terentyev; A. Dubinko; A. Bakaeva; G. De Temmerman,2017,11,124,,405-409,,journal-article,,https://doi.org/10.1016/j.fusengdes.2017.02.043
10.1016/j.fusengdes.2017.04.038,Specific design and structural issues of single crystalline first mirrors for diagnostics,Yury Krasikov; Anatoly Panin; Andrey Litnovsky; Philippe Mertens; Michael Schrader,2017,11,124,,548-552,,journal-article,,https://doi.org/10.1016/j.fusengdes.2017.04.038
10.1016/j.fusengdes.2016.12.006,Advanced materials for a damage resilient divertor concept for DEMO: Powder-metallurgical tungsten-fibre reinforced tungsten,J.W. Coenen; Y. Mao; J. Almanstötter; A. Calvo; S. Sistla; H. Gietl; B. Jasper; J. Riesch; M. Rieth; G. Pintsuk; F. Klein; A. Litnovsky; A.V. Mueller; T. Wegener; J.-H. You; Ch. Broeckmann; C. Garcia-Rosales; R. Neu; Ch. Linsmeier,2017,11,124,,964-968,,journal-article,,https://doi.org/10.1016/j.fusengdes.2016.12.006
10.1016/j.fusengdes.2017.04.035,Development of the bronze processed Nb3Sn multifilamentary wires using Cu-Sn-Zn ternary alloy matrix,Yoshimitsu Hishinuma; Hidetoshi Oguro; Hiroyasu Taniguchi; Akihiro Kikuchi,2017,11,124,,90-93,,journal-article,,https://doi.org/10.1016/j.fusengdes.2017.04.035
10.1016/j.fusengdes.2017.04.119,"Tensile properties of F82H steel after aging at 400–650 °C for 1000–30,000 h",Takuya Nagasaka; Masami Ando; Hiroyasu Tanigawa; Hideo Sakasegawa; Teruya Tanaka; Takeo Muroga; Akio Sagara,2017,11,124,,1011-1014,,journal-article,,https://doi.org/10.1016/j.fusengdes.2017.04.119
10.1016/j.fusengdes.2016.12.022,Local copper coating of the connectors of the divertor target elements of Wendelstein 7-X,P. Junghanns; J. Boscary; M. Busch; B. Mendelevitch; R. Stadler,2017,11,124,,483-486,,journal-article,,https://doi.org/10.1016/j.fusengdes.2016.12.022
10.1016/j.fusengdes.2017.05.012,Development of advanced hydrogen permeation sensors to measure Q2 concentration in lead-lithium eutectic alloy,L. Candido; M. Utili; M. Zucchetti; A. Ciampichetti; P. Calderoni,2017,11,124,,735-739,,journal-article,,https://doi.org/10.1016/j.fusengdes.2017.05.012
10.1016/j.fusengdes.2017.01.017,Thermal conductivity and diffusivity of Cu-Y alloys produced by different powder metallurgy routes,G. Carro; A. Muñoz; M.A. Monge; B. Savoini; A. Galatanu; M. Galatanu; R. Pareja,2017,11,124,,1156-1160,,journal-article,,https://doi.org/10.1016/j.fusengdes.2017.01.017
10.1016/j.fusengdes.2017.03.015,3D Analysis of magnetic field lines to assess the impact of stray fields at breakdown in ITER,A. Formisano; R. Albanese; G. Ambrosino; M. de Magistris; P. De Vries; Y. Gribov; F. Ledda; R. Martone; M. Mattei; S. Minucci; A. Pironti; F. Pizzo; J. Snipes; F. Villone; L. Zabeo,2017,11,123,,597-602,,journal-article,,https://doi.org/10.1016/j.fusengdes.2017.03.015
10.1016/j.fusengdes.2017.03.070,Al2O3 coating as barrier against corrosion in Pb-17Li,M. Carmona Gazquez; S. Bassini; T. Hernandez; M. Utili,2017,11,124,,837-840,,journal-article,,https://doi.org/10.1016/j.fusengdes.2017.03.070
10.1016/j.fusengdes.2017.04.042,Effect of irradiation hardening on brittle fracture performance of box-shaped blanket fabricated by F-82H,Takeshi Miyazawa; Hiroyasu Tanigawa; Mitsuru Ohata,2017,11,124,,1033-1037,,journal-article,,https://doi.org/10.1016/j.fusengdes.2017.04.042
10.1016/j.fusengdes.2017.03.153,Characterization and performance improvement of the large titanium sublimation pumps in the AUG and W7‐X neutral beam injectors,G. Orozco; M. Froeschle; B. Heinemann; C. Hopf; R. Nocentini; R. Riedl,2017,11,123,,381-384,,journal-article,,https://doi.org/10.1016/j.fusengdes.2017.03.153
10.1016/j.fusengdes.2017.04.046,Mechanical properties of ARAA steel after electron beam welding,Jae Sung Yoon; Suk-Kwon Kim; Eo Hwak Lee; Hyung Gon Jin; Dong Won Lee; Seungyon Cho,2017,11,124,,774-778,,journal-article,,https://doi.org/10.1016/j.fusengdes.2017.04.046
10.1016/j.fusengdes.2017.03.062,Free or confined arc model relevant to the quench hazard of large superconducting coils,A.D. Ash; A.J.T. Holmes; S. Zheng; S. McIntosh; K. Cave-Ayland; F. Domptail; E. Surrey; N. Taylor; K. Hamada; N. Mitchell,2017,11,124,,119-122,,journal-article,,https://doi.org/10.1016/j.fusengdes.2017.03.062
10.1016/j.fusengdes.2017.02.086,The study of defect structure in tungsten: Rotation and migration property for the self-interstitial atoms,Shu long Wen; Hong Zhang; Kai Hui He; Xin Sheng Yang; Hui Na Cui; Min Pan; Zheng Huang; Yong Zhao,2017,11,124,,1122-1126,,journal-article,,https://doi.org/10.1016/j.fusengdes.2017.02.086
10.1016/j.fusengdes.2017.04.076,Measurement of tritium in tungsten deposition layer by imaging plate technique after exposure to gaseous tritium,M. Noguchi; K. Katayama; Y. Torikai; N. Ashikawa; A. Taguchi; S. Fukada,2017,11,124,,257-261,,journal-article,,https://doi.org/10.1016/j.fusengdes.2017.04.076
10.1016/j.fusengdes.2017.03.031,Design modification of structural components for the helical fusion reactor FFHR-d1 with challenging options,Hitoshi Tamura; Nagato Yanagi; Takuya Goto; Junichi Miyazawa; Teruya Tanaka; Akio Sagara; Satoshi Ito; Hidetoshi Hashizume,2017,11,124,,605-609,,journal-article,,https://doi.org/10.1016/j.fusengdes.2017.03.031
10.1016/j.fusengdes.2017.03.118,Quantifying TBR uncertainty due to lead nuclear data in HCLL blanket modelling by the Total Monte-Carlo method,F. Thomas; M. Fleming,2017,11,124,,814-817,,journal-article,,https://doi.org/10.1016/j.fusengdes.2017.03.118
10.1016/j.fusengdes.2017.02.061,Initial definition of structural load conditions in DEMO,C. Bachmann; W. Biel; S. Ciattaglia; G. Federici; F. Maviglia; G. Mazzone; G. Ramogida; F. Villone; N. Taylor,2017,11,124,,633-637,,journal-article,,https://doi.org/10.1016/j.fusengdes.2017.02.061
10.1016/j.fusengdes.2017.03.045,Erosion and morphology changes of F82H steel under simultaneous hydrogen and helium irradiation,K. Yakushiji; H.T. Lee; M. Oya; M. Tokitani; A. Sagara; Y. Hamaji; K. Uenishi; K. Ibano; Y. Ueda,2017,11,124,,356-359,,journal-article,,https://doi.org/10.1016/j.fusengdes.2017.03.045
10.1016/j.fusengdes.2017.02.080,Radiological impact mitigation of waste coming from the European fusion reactor DEMO with DCLL breeding blanket,Iole Palermo; Raquel Garcia; Mauricio Garcia; Javier Sanz,2017,11,124,,1257-1262,,journal-article,,https://doi.org/10.1016/j.fusengdes.2017.02.080
10.1016/j.fusengdes.2017.02.057,Testing of sandwich molybdenum mirrors with radiative cooling for H-alpha and visible spectroscopy in ITER,Ilya Orlovskiy; Andrey Alekseev; Evgeniy Andreenko; Gleb Asadulin; Aleksey Gorshkov,2017,11,123,,1011-1014,,journal-article,,https://doi.org/10.1016/j.fusengdes.2017.02.057
10.1016/j.fusengdes.2017.02.054,Tensile deformation behavior of tungsten fibre-reinforced tungsten composite specimens in as-fabricated state,H. Gietl; J. Riesch; J.W. Coenen; T. Höschen; Ch. Linsmeier; R. Neu,2017,11,124,,396-400,,journal-article,,https://doi.org/10.1016/j.fusengdes.2017.02.054
10.1016/j.fusengdes.2017.08.022,ACTYS-1-GO: A faster and accurate algorithm for multipoint nuclear activation calculations,Priti Kanth; Sai Chaitanya Tadepalli; R. Srinivasan; P.V. Subhash,2017,11,122,,154-162,,journal-article,,https://doi.org/10.1016/j.fusengdes.2017.08.022
10.1016/j.fusengdes.2017.03.103,Application of fracture mechanical assessment to in-wall shield ribs in ITER vacuum vessel,Yu-Gyeong Kim; Hyun-Soo Kim; Chul-Kyu Park; Gwang-Ho Kim; Ho-Kyu Moon; Kwen-Hee Hong; Woo-Ho Chung; Hyeon-Gon Lee; Jeong-Woo Sa; Chang-Ho Choi; Jae-Min Sim; Yoon-Suk Chang,2017,11,124,,572-577,,journal-article,,https://doi.org/10.1016/j.fusengdes.2017.03.103
10.1016/j.fusengdes.2017.01.054,Design of a new experimental loop and of a coolant purifying system for corrosion experiments of EUROFER samples in flowing PbLi environment,D. Martelli; G. Barone; M. Tarantino; M. Utili,2017,11,124,,1144-1149,,journal-article,,https://doi.org/10.1016/j.fusengdes.2017.01.054
10.1016/j.fusengdes.2017.02.092,Potential approach of IR-analysis for high heat flux quality assessment of divertor tungsten monoblock components,Henri Greuner; B. Böswirth; H. Maier; T. Hirai; S. Panayotis; F. Crescenzi; S. Roccella; E. Visca; M. Missirlian; M. Richou,2017,11,124,,202-206,,journal-article,,https://doi.org/10.1016/j.fusengdes.2017.02.092
10.1016/j.fusengdes.2017.04.034,Long-lived radionuclide activity formed in ITER construction steels in 6Li-D converter neutron field,W. Pohorecki; P. Jodłowski; K. Pytel; R. Prokopowicz,2017,11,124,,1042-1045,,journal-article,,https://doi.org/10.1016/j.fusengdes.2017.04.034
10.1016/j.fusengdes.2017.03.158,Changes in mechanical property and microstructure of lithium metatitanate tritium breeder caused by thermal annealing,Yu Otani; Kiyoto Shin-mura; Seiya Ogawa; Tsuyoshi Hoshino; Kazuya Sasaki,2017,11,124,,801-804,,journal-article,,https://doi.org/10.1016/j.fusengdes.2017.03.158
